{
  "$schema": "https://json-schema.org/draft/2020-12/schema",
  "$id": "https://schemas.rxscan.ca/publication/registry-event-1.0.0.schema.json",
  "type": "object",
  "additionalProperties": false,
  "required": ["schemaVersion", "eventId", "releaseId", "state", "occurredAt", "actor", "reason"],
  "properties": {
    "schemaVersion": { "const": "1.0.0" },
    "eventId": { "type": "string", "minLength": 1 },
    "releaseId": { "type": "string", "minLength": 1 },
    "state": { "enum": ["candidate", "approved", "stable", "withdrawn"] },
    "occurredAt": { "type": "string", "format": "date-time" },
    "actor": { "type": "string", "minLength": 1 },
    "reason": { "type": "string", "minLength": 1 }
  }
}
