{
  "actor": "Mathieu Fortin — RxScan Technologies",
  "eventId": "2026-07-21T20-14-30Z-candidate-rxscan-core-1.7.0@2026.07.21.1+28851b2c1ad4",
  "occurredAt": "2026-07-21T20:14:30Z",
  "reason": "Development channel publication",
  "releaseId": "rxscan-core-1.7.0@2026.07.21.1+28851b2c1ad4",
  "schemaVersion": "1.0.0",
  "state": "candidate"
}
