{
  "actor": "Mathieu Fortin — RxScan Technologies",
  "eventId": "2026-08-07T02-24-00.000Z-stable-rxscan-core-2.0.0@2026.08.06.1+59fe6cd1f33f",
  "occurredAt": "2026-08-07T02:24:00.000Z",
  "reason": "Approved stable promotion",
  "releaseId": "rxscan-core-2.0.0@2026.08.06.1+59fe6cd1f33f",
  "schemaVersion": "1.0.0",
  "state": "stable"
}
